{"schema":"dev.changeloop.tui-evidence","recordVersion":1,"evidenceClass":"diagnostic-smoke","capturedAt":"2026-08-04T21:46:49.745078+00:00","binary":{"path":"target/release/cloop","sha256":"ce0cdf7ca878b15b6ed736b01134332837f308b02e9b2e01438090a89bbc5326","profile":"release"},"revision":{"gitRevision":"e3518d4016d53f34b90d5d09bbf36f8757661107","dirty":true},"environment":{"os":"Darwin","release":"25.6.0","architecture":"arm64","python":"3.12.8"},"integrity":{"start":{"target/release/cloop":"ce0cdf7ca878b15b6ed736b01134332837f308b02e9b2e01438090a89bbc5326","Cargo.lock":"b6bba3487a29138263ebde3d6595b8a28d6428e4a51eb9493a5bb2c5af7d52d7","crates/changeloop-app-server/src/executable.rs":"f8039a1043a32c3773d1fc5d5a7455e840435670ade6a79dc95e15e822a1792f","crates/changeloop-cli/src/main.rs":"6d331e28b9ec9f48dfe932068770f3bceabdbd67684889d4f1315a80dafe3c21","scripts/performance/tui_evidence.py":"1b1851c5becb3c89b0273e67e990bdd5d4ae23cd20e0af4b290031bd19f2c0ad","scripts/performance/assess_tui_evidence.py":"b736bc3956b427066ba013aed0b2078449b4e3d08c216df747090391145c1dc0","scripts/performance/tui_provider_burst_probe.py":"267d6cd688b3f6c5a29e669b612ca032525a9758279e187a2cb700bdfc974f2f","tests/performance/tui-evidence.schema.json":"210fe696d8f3c993d31b4c1eeb5b71695318a377a4593f02bf3f562d672d65f4","scripts/performance/tui_probe.py":"f6bca9645c5cc261ca119ea74de6ca231bd6357eee62d48030b6a03e8b5151ad","scripts/performance/tui_robustness_probe.py":"23c06ebbeee009469aa3bdc46ae56f1870c3772abeefbf6f54edabc424f9e2de","scripts/performance/tui_terminal_cleanup_probe.py":"141bcc8f2d54f6cda4d4550fb3c472c6fed4a9629c4b1d0b23a975f2590ebfe3","scripts/performance/tui_portability_probe.py":"c5f9db436e867657174c80e6c2e9ffceb14299337630543f5e6fbf8ef6aa3fe6"},"end":{"target/release/cloop":"ce0cdf7ca878b15b6ed736b01134332837f308b02e9b2e01438090a89bbc5326","Cargo.lock":"b6bba3487a29138263ebde3d6595b8a28d6428e4a51eb9493a5bb2c5af7d52d7","crates/changeloop-app-server/src/executable.rs":"f8039a1043a32c3773d1fc5d5a7455e840435670ade6a79dc95e15e822a1792f","crates/changeloop-cli/src/main.rs":"6d331e28b9ec9f48dfe932068770f3bceabdbd67684889d4f1315a80dafe3c21","scripts/performance/tui_evidence.py":"1b1851c5becb3c89b0273e67e990bdd5d4ae23cd20e0af4b290031bd19f2c0ad","scripts/performance/assess_tui_evidence.py":"b736bc3956b427066ba013aed0b2078449b4e3d08c216df747090391145c1dc0","scripts/performance/tui_provider_burst_probe.py":"267d6cd688b3f6c5a29e669b612ca032525a9758279e187a2cb700bdfc974f2f","tests/performance/tui-evidence.schema.json":"210fe696d8f3c993d31b4c1eeb5b71695318a377a4593f02bf3f562d672d65f4","scripts/performance/tui_probe.py":"f6bca9645c5cc261ca119ea74de6ca231bd6357eee62d48030b6a03e8b5151ad","scripts/performance/tui_robustness_probe.py":"23c06ebbeee009469aa3bdc46ae56f1870c3772abeefbf6f54edabc424f9e2de","scripts/performance/tui_terminal_cleanup_probe.py":"141bcc8f2d54f6cda4d4550fb3c472c6fed4a9629c4b1d0b23a975f2590ebfe3","scripts/performance/tui_portability_probe.py":"c5f9db436e867657174c80e6c2e9ffceb14299337630543f5e6fbf8ef6aa3fe6"},"unchanged":true},"cases":{"startupReady":{"passed":true,"complete":true,"timedOut":false,"exitCode":0,"durationMs":310.106,"parseError":null,"output":{"recordVersion":1,"probe":"keyboard-responsive-tui-ready","workloadVersion":"tui-status-readiness-pty-v4","repetitions":3,"warmups":1,"samplesNs":[61448750,58429375,52795209],"observations":[{"ready":true,"durationNs":61448750,"statusSent":true,"statusReady":true,"onboardingGuidance":false,"quitSent":true,"exitStatus":0,"reason":null,"outputTail":null},{"ready":true,"durationNs":58429375,"statusSent":true,"statusReady":true,"onboardingGuidance":false,"quitSent":true,"exitStatus":0,"reason":null,"outputTail":null},{"ready":true,"durationNs":52795209,"statusSent":true,"statusReady":true,"onboardingGuidance":false,"quitSent":true,"exitStatus":0,"reason":null,"outputTail":null}],"thresholdMs":750,"correctness":{"completeFrame":true,"keyboardResponse":"/status card with ready JSON","noProviderGuidance":false,"cleanQuit":true}},"stderrTail":""},"resizeUnicodeCtrlC":{"passed":true,"complete":true,"timedOut":false,"exitCode":0,"durationMs":1006.915,"parseError":null,"output":{"passed":true,"exitStatus":0,"resizeEvents":500,"slowReaderPauseMs":200,"unicodePasteObserved":true,"statusAfterPaste":true,"ctrlCEscalationExited":true,"capturedBytes":8646,"outputTail":null},"stderrTail":""},"signalIdleCleanup":{"passed":true,"complete":true,"timedOut":false,"exitCode":0,"durationMs":1350.35,"parseError":null,"output":{"passed":true,"exitStatus":0,"termiosRestored":true,"bracketedPasteEnabled":true,"bracketedPasteDisabled":true,"idleWallMs":1009.929,"processCpuMs":7.486,"cpuThresholdMs":100},"stderrTail":""},"terminalPortability":{"passed":true,"complete":true,"timedOut":false,"exitCode":0,"durationMs":51.868,"parseError":null,"output":{"passed":true,"nonTtyRejected":true,"dumbRejected":true,"noColorBooted":true,"noColorHasNoColorSgr":true,"headlessStatus":2,"dumbStatus":2,"noColorStatus":0,"noColorBytes":1956},"stderrTail":""},"eventBurstCompaction":{"passed":true,"complete":true,"timedOut":false,"exitCode":0,"durationMs":19619.575,"externalPtyInjectionSupported":false,"unsupportedReason":"the public TUI has no test-only event injection endpoint","deterministicRegression":{"eventsInserted":100000,"retainedCards":256,"passed":true},"stderrTail":"   Compiling changeloop-protocol v0.1.0 (/Users/hashtagf/Desktop/Work/claude-foundation/crates/changeloop-protocol)\n   Compiling changeloop-harness v0.1.0 (/Users/hashtagf/Desktop/Work/claude-foundation/crates/changeloop-harness)\n   Compiling changeloop-storage v0.1.0 (/Users/hashtagf/Desktop/Work/claude-foundation/crates/changeloop-storage)\n   Compiling changeloop-agent v0.1.0 (/Users/hashtagf/Desktop/Work/claude-foundation/crates/changeloop-agent)\n   Compiling changeloop-session v0.1.0 (/Users/hashtagf/Desktop/Work/claude-foundation/crates/changeloop-session)\n   Compiling changeloop-ops v0.1.0 (/Users/hashtagf/Desktop/Work/claude-foundation/crates/changeloop-ops)\n   Compiling changeloop-tools v0.1.0 (/Users/hashtagf/Desktop/Work/claude-foundation/crates/changeloop-tools)\n   Compiling changeloop-runtime v0.1.0 (/Users/hashtagf/Desktop/Work/claude-foundation/crates/changeloop-runtime)\n   Compiling changeloop-app-server v0.1.0 (/Users/hashtagf/Desktop/Work/claude-foundation/crates/changeloop-app-server)\n    Finished `test` profile [unoptimized + debuginfo] target(s) in 14.38s\n     Running unittests src/lib.rs (target/debug/deps/changeloop_app_server-374432ef0c7ad728)\n"},"providerStream10k":{"passed":false,"complete":true,"supported":false,"timedOut":false,"exitCode":3,"durationMs":599.054,"parseError":null,"output":{"passed":false,"complete":true,"supported":false,"reason":"release ProviderBackend constructs the default OpenAI adapter and exposes no trusted literal-loopback endpoint contract; launching an ask would contact the real provider and is therefore prohibited","requiredEndpointVariable":"CHANGELOOP_OPENAI_ENDPOINT","fixture":{"boundHost":"127.0.0.1","endpoint":"http://127.0.0.1:52489/v1/responses","deltaCount":10000,"contentType":"text/event-stream","requestsReceived":0},"network":{"allowedDestinations":["127.0.0.1:52489"],"attemptedDestinations":[],"externalNetworkAttempted":false},"credentials":{"realCredentialLoaded":false,"credentialSent":false}},"stderrTail":""}},"commands":[{"command":["/Library/Frameworks/Python.framework/Versions/3.12/bin/python3","/Users/hashtagf/Desktop/Work/claude-foundation/scripts/performance/tui_probe.py","/Users/hashtagf/Desktop/Work/claude-foundation/target/release/cloop"],"timeoutSeconds":30,"timedOut":false,"exitCode":0,"durationMs":310.106},{"command":["/Library/Frameworks/Python.framework/Versions/3.12/bin/python3","/Users/hashtagf/Desktop/Work/claude-foundation/scripts/performance/tui_robustness_probe.py","/Users/hashtagf/Desktop/Work/claude-foundation/target/release/cloop"],"timeoutSeconds":15,"timedOut":false,"exitCode":0,"durationMs":1006.915},{"command":["/Library/Frameworks/Python.framework/Versions/3.12/bin/python3","/Users/hashtagf/Desktop/Work/claude-foundation/scripts/performance/tui_terminal_cleanup_probe.py","/Users/hashtagf/Desktop/Work/claude-foundation/target/release/cloop"],"timeoutSeconds":15,"timedOut":false,"exitCode":0,"durationMs":1350.35},{"command":["/Library/Frameworks/Python.framework/Versions/3.12/bin/python3","/Users/hashtagf/Desktop/Work/claude-foundation/scripts/performance/tui_portability_probe.py","/Users/hashtagf/Desktop/Work/claude-foundation/target/release/cloop"],"timeoutSeconds":15,"timedOut":false,"exitCode":0,"durationMs":51.868},{"command":["cargo","test","-p","changeloop-app-server","tui_scrollback_compacts_a_hundred_thousand_events_and_renders_stably"],"timeoutSeconds":120,"timedOut":false,"exitCode":0,"durationMs":19619.575},{"command":["/Library/Frameworks/Python.framework/Versions/3.12/bin/python3","/Users/hashtagf/Desktop/Work/claude-foundation/scripts/performance/tui_provider_burst_probe.py","/Users/hashtagf/Desktop/Work/claude-foundation/target/release/cloop"],"timeoutSeconds":15,"timedOut":false,"exitCode":3,"durationMs":599.054}],"overall":{"diagnosticPassed":false,"releaseEligible":false,"releaseGap":"release ProviderBackend exposes no trusted literal-loopback endpoint contract, so real PTY 10k provider streaming is fail-closed; full release-machine repetitions also remain required"}}
